{
  "id": "decision-log",
  "class": "A-hybrid",
  "description": "Multiple edits/writes have happened since the last decision-log entry. Invoke the decision-log skill to record the silent decision contemporaneously.",
  "detection": {
    "type": "state_counter",
    "tools": ["Edit", "Write", "NotebookEdit"],
    "counter": "writes-since-dlog",
    "reset_on": {
      "tool": "Skill",
      "skill_substring": "autopilot-v2:decision-log"
    },
    "threshold": 3,
    "threshold_env_override": "AUTOPILOT_DLOG_THRESHOLD"
  },
  "action": "nudge",
  "checkpoint_template_id": null,
  "advisory_text": "3+ edits since last decision-log entry. You MUST invoke the autopilot-v2:decision-log skill BEFORE the next edit. Record the load-bearing decision behind this batch (which approach you chose, why, what alternatives you considered) — don't reconstruct it at handback; log it now.",
  "fixture_id": "04-decision-log"
}
