{
  "id": "irreversibility",
  "class": "A",
  "description": "About to do something irreversible (push, force-push, publish, rm -rf, prod deploy). Pause and confirm.",
  "detection": {
    "type": "bash_pattern",
    "tools": ["Bash"],
    "patterns": [
      "\\bgit\\s+push\\b",
      "\\bgit\\s+commit\\s+.*--amend\\b",
      "\\bnpm\\s+publish\\b",
      "\\byarn\\s+publish\\b",
      "\\bpnpm\\s+publish\\b",
      "\\bcargo\\s+publish\\b",
      "\\brm\\s+-rf\\b",
      "\\bsudo\\s+rm\\b",
      "\\bDROP\\s+TABLE\\b",
      "\\bTRUNCATE\\s+TABLE\\b"
    ]
  },
  "action": "nudge",
  "checkpoint_template_id": "irreversible",
  "advisory_text": "This operation is non-destructive but state-mutating and hard to unwind. You SHOULD invoke AskUserQuestion BEFORE proceeding unless the brief explicitly authorized this exact action. If the brief just implied it (e.g. 'make teammates see this', 'ship this', 'publish'), ASK FIRST. Use the autopilot-v2:checkpoint-format template for the question.",
  "fixture_id": "02-irreversibility"
}
